{
  "schema_version": "sec-fund-family-baseline/v1",
  "fixture_id": "fund-fixed-income-mutual-partial-v1",
  "instrument_id": "00000000-0000-4000-8000-000000000002",
  "series_id": "S000000002",
  "class_id": "C000000002",
  "asset_family": "fixed_income",
  "vehicle": "mutual_fund",
  "classification_policy_version": "portfolio-composition-v3",
  "source_dates": {"nport": "2026-01-31", "ncen": "2025-06-30", "rr1": "2026-01-20", "nav": "2026-07-16"},
  "capabilities": {
    "holdings": {"state": "available", "source_applicable": true, "as_of": "2026-01-31", "coverage_pct": 97.0, "source": "nport", "reason_code": null, "methodology_version": "holdings-v2"},
    "equity_style": {"state": "not_applicable", "source_applicable": false, "as_of": null, "coverage_pct": null, "source": null, "reason_code": "asset_family_not_applicable", "methodology_version": null},
    "fixed_income_profile": {"state": "degraded", "source_applicable": true, "as_of": "2026-01-31", "coverage_pct": 84.0, "source": "nport", "reason_code": "debt_extension_coverage_below_certified", "methodology_version": "fixed-income-native-v1"},
    "multi_asset_allocation": {"state": "not_applicable", "source_applicable": false, "as_of": null, "coverage_pct": null, "source": null, "reason_code": "asset_family_not_applicable", "methodology_version": null},
    "alternatives_profile": {"state": "not_applicable", "source_applicable": false, "as_of": null, "coverage_pct": null, "source": null, "reason_code": "asset_family_not_applicable", "methodology_version": null},
    "cash_profile": {"state": "not_applicable", "source_applicable": false, "as_of": null, "coverage_pct": null, "source": null, "reason_code": "asset_family_not_applicable", "methodology_version": null},
    "fees_and_share_classes": {"state": "available", "source_applicable": true, "as_of": "2026-01-20", "coverage_pct": 100.0, "source": "rr1", "reason_code": null, "methodology_version": "rr1-fees-v1"},
    "prospectus_disclosures": {"state": "available", "source_applicable": true, "as_of": "2026-01-20", "coverage_pct": 100.0, "source": "rr1", "reason_code": null, "methodology_version": "rr1-disclosures-v1"},
    "prospectus_performance": {"state": "unavailable", "source_applicable": true, "as_of": null, "coverage_pct": null, "source": "rr1", "reason_code": "performance_context_unavailable", "methodology_version": null},
    "operating_profile": {"state": "available", "source_applicable": true, "as_of": "2025-06-30", "coverage_pct": 100.0, "source": "ncen", "reason_code": null, "methodology_version": "ncen-operating-v1"}
  }
}
