{
  "schema_version": "sec-fund-family-baseline/v1",
  "fixture_id": "fund-equity-etf-complete-v1",
  "instrument_id": "00000000-0000-4000-8000-000000000001",
  "series_id": "S000000001",
  "class_id": "C000000001",
  "asset_family": "equity",
  "vehicle": "etf",
  "classification_policy_version": "portfolio-composition-v3",
  "source_dates": {
    "nport": "2026-01-31",
    "ncen": "2025-09-30",
    "rr1": "2026-02-15",
    "nav": "2026-07-16"
  },
  "capabilities": {
    "holdings": {"state": "available", "source_applicable": true, "as_of": "2026-01-31", "coverage_pct": 99.1, "source": "nport", "reason_code": null, "methodology_version": "holdings-v2"},
    "equity_style": {"state": "available", "source_applicable": true, "as_of": "2026-01-31", "coverage_pct": 94.0, "source": "nport+market", "reason_code": null, "methodology_version": "equity-profile-v1"},
    "fixed_income_profile": {"state": "not_applicable", "source_applicable": false, "as_of": null, "coverage_pct": null, "source": null, "reason_code": "asset_family_not_applicable", "methodology_version": null},
    "multi_asset_allocation": {"state": "not_applicable", "source_applicable": false, "as_of": null, "coverage_pct": null, "source": null, "reason_code": "asset_family_not_applicable", "methodology_version": null},
    "alternatives_profile": {"state": "not_applicable", "source_applicable": false, "as_of": null, "coverage_pct": null, "source": null, "reason_code": "asset_family_not_applicable", "methodology_version": null},
    "cash_profile": {"state": "not_applicable", "source_applicable": false, "as_of": null, "coverage_pct": null, "source": null, "reason_code": "asset_family_not_applicable", "methodology_version": null},
    "fees_and_share_classes": {"state": "available", "source_applicable": true, "as_of": "2026-02-15", "coverage_pct": 100.0, "source": "rr1", "reason_code": null, "methodology_version": "rr1-fees-v1"},
    "prospectus_disclosures": {"state": "available", "source_applicable": true, "as_of": "2026-02-15", "coverage_pct": 100.0, "source": "rr1", "reason_code": null, "methodology_version": "rr1-disclosures-v1"},
    "prospectus_performance": {"state": "degraded", "source_applicable": true, "as_of": "2026-02-15", "coverage_pct": 63.0, "source": "rr1", "reason_code": "partial_measure_context", "methodology_version": "rr1-performance-v1"},
    "operating_profile": {"state": "available", "source_applicable": true, "as_of": "2025-09-30", "coverage_pct": 100.0, "source": "ncen", "reason_code": null, "methodology_version": "ncen-operating-v1"}
  }
}
